{"name": "Pera de Madeira", "ingredients": [{"quantity": "1", "item": "Avu\u00e1 B\u00e1lsamo aged cacha\u00e7a", "unit": "oz", "isGarnish": false}, {"quantity": "1/2", "item": "Denizen aged white rum", "unit": "oz", "isGarnish": false}, {"quantity": "1/2", "item": "Smith & Cross rum", "unit": "oz", "isGarnish": false}, {"quantity": "1/2", "item": "Matcha syrup*", "unit": "oz", "isGarnish": false}, {"quantity": "1/2", "item": "Fresh lemon juice", "unit": "oz", "isGarnish": false}, {"quantity": "1/2", "item": "Pear juice", "unit": "oz", "isGarnish": false}, {"quantity": "", "item": "Pernod absinthe", "unit": "mist", "isGarnish": false}, {"quantity": "", "item": "Pear slices", "unit": "", "isGarnish": true}, {"quantity": "", "item": "Maraschino cherry", "unit": "", "isGarnish": true}], "preparation": "Stephen Bielawski, a bartender at Fort Defiance in New York City, created the Pera de Madeira for the winter holidays, blessed with rum funk and green freshness from aged Avu\u00e1 B\u00e1lsamo aged cacha\u00e7a and a blend of Denizen and Smith & Cross rums. Matcha syrup brings grassy notes, balanced by fruity, sour pear and lemon juices.\n\nThis recipe originally appeared as part of \u201c11 Holiday-Perfect Cocktails to Drink in Bars Now.\u201d\n\nAdd all the ingredients into a shaker with ice and shake.\n\nSpray a mist of the absinthe into a chilled coupe.\n\nStrain the mixture into the glass.\n\nGarnish with skewered pear slices formed into a rose around a Luxardo maraschino cherry.\n\n*Matcha syrup: Heat 1/2 cup water in small pot on stove until simmering. Remove from heat and add 2 whole leaf matcha tea bags. Infuse for about 10 minutes. Once tea is steeped, remove bags, return pot to stove and bring to a slow boil. Stir in 1/2 cup sugar until completely dissolved. Remove from heat and let stand until cool before using or refrigerating.", "imageURL": "https://www.liquor.com/thmb/oem25sYdJw2hx_dv3gekFqnWnH0=/960x0/filters:no_upscale():max_bytes(150000):strip_icc()/__opt__aboutcom__coeus__resources__content_migration__liquor__2018__12__04123007__pera-de-madeira-720x720-recipe-d9a49481535c423eb63be4e308c7ce3f.jpg", "authorName": "Stephen Bielawski", "reviewCount": null, "avgRating": null}